{"schemaVersion":1,"repositoryId":"demo","generatedAt":"2026-01-01T00:00:00Z","layout":{"blobTemplate":"blobs/{alg}/{h0:2}/{h2:2}/{hash}","packageTemplate":"packages/{packageId}/{version}/package.json","packageIndexTemplate":"packages/{packageId}/index{page}.json","channelTemplate":"products/{productId}/channels/{channel}.json","releaseTemplate":"products/{productId}/releases/{releaseId}/release.lock.json","releaseBundleTemplate":"products/{productId}/releases/{releaseId}/release.bundle.json","coverageTemplate":"products/{productId}/releases/{releaseId}/coverage.json","releaseIndexTemplate":"products/{productId}/releases/index{page}.json","keyManifestTemplate":"keys.json","revocationTemplate":"products/{productId}/revocations.json"},"contentHashAlgorithm":"sha256","capabilities":["read","range"]}
